{
  "id": "rec-001",
  "skill": "revenue-growth",
  "recommendation": "Build a second-purchase automation targeting first-time buyers at the observed first-to-second purchase interval.",
  "priority": "high",
  "reason": [
    "The frequency term of the revenue equation is the weakest of the three.",
    "No automation currently covers the first-time to repeat buyer transition.",
    "The audience flows continuously, so the journey earns repeatedly rather than once."
  ],
  "evidence": [
    {
      "metric": "second_purchase_rate",
      "value": 0.18,
      "unit": "ratio",
      "source_capability": "email_sms.order_intelligence",
      "period": "2026-01-01/2026-06-30",
      "comparison": "prior six months: 0.24"
    },
    {
      "metric": "first_time_buyer_count",
      "value": 4120,
      "source_capability": "email_sms.customer_intelligence",
      "period": "2026-04-01/2026-06-30"
    }
  ],
  "confidence": 0.72,
  "data_period": "2026-01-01/2026-06-30",
  "sample_size": 4120,
  "risks": [
    "Adds contact load to a segment already receiving welcome and abandonment journeys.",
    "The observed interval is derived from two quarters only."
  ],
  "next_actions": [
    {
      "action": "Design the journey topology",
      "risk_level": "plan",
      "requires_capability": ["email_sms.automation", "email_sms.order_intelligence"],
      "requires_approval": false
    },
    {
      "action": "Activate the journey",
      "risk_level": "high_impact",
      "requires_capability": ["email_sms.automation"],
      "requires_approval": true,
      "depends_on": ["rec-001"]
    }
  ]
}
